[{"age_max":10,"age_min":5,"categories":["stem","quiet-focus","rainy-day"],"group_max":30,"group_min":2,"id":"magnetic-scavenger-hunt","location":["indoor"],"materials":[{"item":"magnets (one per kid or pair)"},{"item":"trays or bowls for sorting"},{"item":"a table of assorted objects: keys, paper clips, coins, rubber bands, foil, plastic toys"}],"name":"Magnetic Scavenger Hunt","no_prep":false,"safety":"Keep magnets away from phones and tablets, and warn kids not to swallow small magnets — ever.","setup":"Lay out a table of mixed objects, half magnetic and half not. Hand out one magnet per kid or pair.","steps":["Let kids freely test objects with their magnets — sort finds into magnetic and not-magnetic trays.","Ask the group to spot the pattern: what do the magnetic ones have in common?","Round two: hide ten magnetic objects around the room and hunt with magnets.","Debrief: magnets attract iron, nickel, and cobalt — not all metal.","Bonus challenge: can a magnet pull a paper clip through paper? Through a hand?"],"tagline":"Hunt the room with a magnet and discover what metal really means.","time_max":30,"time_min":15,"variations":{"easier":"Test only the objects on the table — skip the hiding round.","harder":"Predict first, test second: write guesses before touching the magnet."}},{"age_max":12,"age_min":7,"categories":["stem"],"group_max":30,"group_min":4,"id":"balloon-rocket-race","location":["indoor"],"materials":[{"item":"balloons (one per team, plus spares)"},{"item":"long string or yarn"},{"item":"drinking straws"},{"item":"tape"}],"name":"Balloon Rocket Race","no_prep":true,"safety":"Balloons can pop — keep them away from faces while inflating, and pick up popped pieces right away.","setup":"Thread string through a straw and stretch it tight across the room, taping both ends. Build one lane per team.","steps":["Tape a straw to the top of an uninflated balloon — the straw rides the string.","Inflate the balloon (do not tie it), pinch the end, and clip it to the lane's start.","Countdown and release. The escaping air drives the rocket down the line.","First rocket to the far end wins the heat. Run a bracket.","Engineering round: redesign with two balloons, angled straws, or lighter tape."],"tagline":"A balloon, a straw, and a string — the fastest physics demo in the room.","time_max":40,"time_min":20,"variations":{"easier":"One lane, one rocket at a time — just watch it go.","harder":"Cargo challenge: the rocket must carry a paper-clip passenger the whole lane."}},{"age_max":12,"age_min":7,"categories":["stem","crafts"],"group_max":30,"group_min":2,"id":"paper-bridge-challenge","location":["indoor"],"materials":[{"item":"plain paper (5 sheets per kid)"},{"item":"tape"},{"item":"coins or small blocks as weights"}],"name":"Paper Bridge Challenge","no_prep":true,"safety":"No running with scissors if you cut paper — and keep the testing area clear so bridges do not get stepped on.","setup":"Set two stacks of books about 8 inches apart as the 'river banks.' Hand out paper and a short strip of tape each.","steps":["The challenge: span the gap with paper and hold as many coins as possible.","Give 15 minutes of building — folding, rolling, and corrugating are all legal.","Test one bridge at a time: lay it across the banks and stack coins in the middle.","Record each bridge's coin count on a class chart.","Winner's debrief: what shape held the most — and why?"],"tagline":"Five sheets of paper, one gap, as many coins as it can hold.","time_max":50,"time_min":25,"variations":{"easier":"Allow unlimited tape and skip the coin test — longest span wins.","harder":"Two sheets only, and the bridge must hold a full cup of water."}},{"age_max":10,"age_min":5,"categories":["stem"],"group_max":30,"group_min":2,"id":"static-butterflies","location":["indoor"],"materials":[{"item":"balloons (one per kid)"},{"item":"tissue paper cut into butterfly shapes"},{"item":"a wool cloth or sweater for charging"}],"name":"Static Butterflies","no_prep":false,"safety":"Keep balloons away from faces; rub the balloon on cloth, not on hair, to keep it simple.","setup":"Cut butterfly shapes from tissue paper ahead of time — or let older kids cut their own. Lay them on a table.","steps":["Rub a balloon on a wool cloth for 10 seconds to charge it with static.","Hold the charged balloon just above a tissue butterfly — it lifts and dances without touching.","Challenge: keep the butterfly floating for 10 seconds without it landing.","Test what kills the magic: does a wet butterfly still fly? A heavy one?","End with a butterfly ballet: everyone floats theirs at once to music."],"tagline":"Static electricity makes tissue butterflies dance.","time_max":30,"time_min":15,"variations":{"easier":"One big group demo with a single balloon and butterfly.","harder":"Race: guide your butterfly across the table using only the balloon."}},{"age_max":10,"age_min":5,"categories":["stem","quiet-focus"],"group_max":30,"group_min":2,"id":"water-cycle-in-a-bag","location":["indoor"],"materials":[{"item":"zip-top bags (one per kid)"},{"item":"water"},{"item":"blue washable markers"},{"item":"tape"}],"name":"Water Cycle in a Bag","no_prep":true,"safety":"Bags hang on the window — tape them well so nobody slips on a fallen, wet bag.","setup":"Tape zip bags to a sunny window. Give each kid a marker and a small cup of water.","steps":["Draw a sun and clouds on the upper part of the bag with the marker.","Pour in a quarter-cup of water and seal the bag tight.","Tape the bag to the window and predict what will happen.","Check twice a day: droplets form on the plastic (condensation) and slide down (precipitation).","After a few days, draw the cycle on the board and label each step the class observed."],"tagline":"The whole water cycle, sealed in a bag on the window.","time_max":40,"time_min":20,"variations":{"easier":"One class bag everyone watches together.","harder":"Two bags — one in sun, one in shade — and compare condensation speed."}},{"age_max":8,"age_min":4,"categories":["stem","quiet-focus"],"group_max":25,"group_min":2,"id":"sink-or-float-lab","location":["indoor"],"materials":[{"item":"a wide tub or bin of water"},{"item":"assorted test objects: apple, rock, sponge, coin, cork, toy boat"},{"item":"towels for the inevitable splashes"}],"name":"Sink or Float Lab","no_prep":false,"safety":"Water stays in the tub — towels on the floor, no splashing contests, and dry hands before walking.","setup":"Fill a wide tub halfway with water on a towel-covered table. Gather a tray of test objects.","steps":["Hold up each object and vote: sink or float? Tally predictions on a chart.","Drop the object in and watch. Cheer for the right predictors.","Pull it out and dry it before the next test.","After ten objects, ask: what did the floaters have in common?","Final test: can you make a sinker float by changing its shape (foil boat challenge)?"],"tagline":"Vote, drop, splash — the classic first experiment.","time_max":30,"time_min":15,"variations":{"easier":"Test five big, obvious objects only.","harder":"Add a third vote option: 'sink slowly' — and time the slow sinkers."}},{"age_max":12,"age_min":6,"categories":["team-community","quiet-focus"],"group_max":30,"group_min":2,"id":"appreciation-postcards","location":["indoor"],"materials":[{"item":"blank postcards or half-sheets of cardstock"},{"item":"pens and markers"}],"name":"Appreciation Postcards","no_prep":true,"safety":"Keep notes kind and specific — no backhanded compliments, and nobody has to read theirs aloud.","setup":"Hand out one postcard per kid. Everyone draws a name — or the teacher assigns so nobody is missed.","steps":["Write one specific appreciation: something the person did, not just 'you are nice.'","Decorate the front of the card to match the message.","Drop cards in a mailbox box at the front of the room.","Deliver: read your card privately first, then the group does a thank-you round.","Pin favorites on the wall for the week."],"tagline":"One specific thank-you per kid, delivered like mail.","time_max":40,"time_min":20,"variations":{"easier":"Sentence starters on the board: 'I noticed you...'","harder":"Write the card in the voice of a newspaper headline about that person."}},{"age_max":12,"age_min":5,"categories":["team-community","crafts"],"group_max":40,"group_min":4,"id":"class-mural-project","location":["indoor"],"materials":[{"item":"a long roll of butcher paper"},{"item":"tempera paint or big markers"},{"item":"pencils for sketching"}],"name":"Class Mural Project","no_prep":false,"safety":"Smocks or old shirts for painters, and wash hands before touching anything else.","setup":"Roll butcher paper across a long table or the floor. Sketch a light theme outline — a garden, a city, a galaxy.","steps":["Assign sections: every kid owns one square foot of the mural.","Sketch first in pencil — no paint until the sketch is approved by a neighbor.","Paint the mural together over the session.","Add everyone's name or handprint along the border.","Hang it where the whole school can see it."],"tagline":"One square foot per kid, one giant story on the wall.","time_max":90,"time_min":40,"variations":{"easier":"Coloring-style: the teacher draws the outlines, kids fill them in.","harder":"No talking during painting — the mural must come together silently."}},{"age_max":12,"age_min":8,"categories":["team-community"],"group_max":30,"group_min":4,"id":"community-helper-interviews","location":["indoor"],"materials":[{"item":"paper and pencils"},{"item":"a list of interview questions (made together)"}],"name":"Community Helper Interviews","no_prep":true,"safety":"Interviews happen with the helper visiting the group — kids do not go off alone to find people.","setup":"Invite a community helper (custodian, crossing guard, nurse, librarian) or pick a staff member everyone knows. Prepare questions as a class.","steps":["Brainstorm interview questions together: pick the ten best.","Assign roles: two interviewers, one note-taker